Title,Source_URL,Publish_Date,Category,Content
"PJH bantu atasi penipuan pakej haji, umrah di pasaran",https://www.sinarharian.com.my/article/705271/berita/nasional/pjh-bantu-atasi-penipuan-pakej-haji-umrah-di-pasaran,2025-01-03 19:12:00,BERITA,"SEPANG - Syarikat Pengelola Jemaah Haji (PJH) memainkan peranan penting mengelak unsur penipuan pakej haji dan umrah dalam negara.

Presiden Persatuan Pengendalian Pelancongan Bumiputera Malaysia (Bumitra Malaysia), Dr Wan Muhamad Adam Wan Norudin berkata, PJH dilesenkan Lembaga Tabung Haji (TH) dan terikat dengan akta di bawahnya.

Menurutnya, PJH membawa imej TH dan negara selain dipantau ketat menerusi pembaharuan lesen yang dilakukan setiap tahun.

""PJH terikat dengan akta TH bermakna untuk berlaku penipuan itu adalah kurang berbanding syarikat tidak dilesenkan TH.

""Justeru nasihat menteri meminta pematuhan aspek pakej itu harus diikuti. Mungkin ada kekangan tapi dalam masa sama kita meletakkan PJH satu benda yang utama.

""Disebabkan itu, lesen PJH ini dilesenkan setahun sekali yang dinilai berdasarkan prestasi tahunan,"" katanya ditemui pada Pelancaran Karnival Haji, Umrah dan Pelancongan KHUP PJH di Movenpick Hotel & Convention Centre pada Jumaat.

Dalam pada itu, Wan Muhamad Adam berkata, KHUP kali ketiga itu memainkan peranan penting menyebar luaskan perkhidmatan PJH kepada masyarakat.

Artikel Berkaitan:PJH dinasihat beri perkhidmatan terbaik kepada bakal hajiHONOR Magic7 Pro bantu bongkar penipuan deepfakeTH larang syarikat haji, umrah promosi visa mujamalah, furada

Ujarnya, karnival ini membawa kelainan dengan memperluas kumpulan sasar susulan mendapat sambutan memberangsangkan pada penganjuran tahun lalu.

""Pengunjung yang hadir boleh membuat pelbagai pilihan pakej ditawarkan 37 syarikat PJH mengikut penetapan oleh kerajaan dan TH.

""Kita tawarkan pakej Haji Rahmah pada kadar RM55,000. Insya-ALLAH, apabila datang ke sini ada pakej di bawah itu pun ada untuk dibuat pilihan mengikut kemampuan masing-masing,"" katanya.

Selain itu katanya, kelainan tahun ini turut membawa penyertaan perbankan antaranya RHB Islamic Bank, Maybank serta Bank islam untuk bantu memudahkan jemaah mendapatkan khidmat nasihat dan bantuan bagi yang menghadapi masalah kewangan.

Karnival yang berlangsung selama tiga hari itu membuka tirai pada Jumaat membabitkan penyertaan 37 syarikat PJH dan dirasmikan oleh Menteri Di Jabatan Perdana Menteri (Hal Ehwal Agama), Datuk Dr Mohd Na'im Mokhtar.

Pada ucapan perasmian, Mohd Na'im mengingatkan PJH menjalankan amanah dengan penuh tanggungjawab dan baik serta tidak mencemar nama baik TH.

Mohd Naim berkata, TH menjadi contoh dan rujukan kepada negara lain dalam pengurusan jemaah musim haji selain menerima maklum balas positif di Makkah.

Justeru, PJH yang dilesenkan di bawah TH perlu menjaga imej baik TH dan perlu memastikan perkhidmatan kepada bakal jemaah dilaksanakan mengikut terkandung dalam pakej ditawarkan.

Muat turun aplikasi Sinar Harian.Klik di sini!"
Masjid baharu bakal manfaatkan pengguna Lebuh Raya Kuala Krai-Gua Musang,https://www.sinarharian.com.my/article/702827/edisi/kelantan/masjid-baharu-bakal-manfaatkan-pengguna-lebuh-raya-kuala-krai-gua-musang,2024-12-18 12:20:00,EDISI,"KOTA BHARU - Lebih 1,000 jemaah bakal mendapat manfaat melalui pembinaan sebuah masjid di Taman Guchil Jaya Kuala Krai.

Masjid Ibnu Batutah di Mukim Kecil Bandar Baru Kuala Krai seluas 0.8 hektar itu juga akan memudahkan musafir yang melalui Lebuh Raya Kuala Krai-Gua Musang.

Pengerusi Jawatankuasa Masjid, Dr Mohd Azmi berkata, masjid moden yang bercirikan reka bentuk ala Asia Barat dijangka menjadi mercu tanda baharu di daerah Kuala Krai.

""Tempat ibadah ini juga disediakan dengan pelbagai kemudahan awam termasuk taman rekreasi dan medan selera sekali gus sesuai menjadi lokasi rehat dan rawat untuk pengguna lebuh raya,"" katanya kepada Sinar Harian.Beliau memberitahu, antara komponen penting dalam pembinaannya ialah pejabat dan bilik mesyuarat, ruang jamuan terbuka, kedai runcit, gelanggang bola keranjang dan gerai makanan.Tambahnya selain tempat solat, antara ruang penting lain yang dibina ialah bilik pengurusan jenazah, tandas orang kurang upaya dan wakaf berehat musafir.Justeru Dr Mohd Azmi memberitahu, jumlah dana yang diperlukan ialah RM11,725,640.Artikel Berkaitan:Dua syarikat perlombongan di Gua Musang diarah henti kerja serta-mertaPenduduk pedalaman Gua Musang bakal nikmati bank bergerakMKT UMNO syor Nenggiri dikecilkan, pecahkan Gua Musang jadi 3 ParlimenOrang ramai yang ini menghulurkan sumbangan boleh berbuat demikian melalui nombor akaun Bank Islam 03072010139591 atas nama Masjid Mukim Kecil, Bandar Baru Kuala Krai (Ibnu Batutah) atau menghubungi Dr Mohd Azmi Yaacob di talian 019-6565354.Muat turun aplikasi Sinar Harian.Klik di sini!

""Tempat ibadah ini juga disediakan dengan pelbagai kemudahan awam termasuk taman rekreasi dan medan selera sekali gus sesuai menjadi lokasi rehat dan rawat untuk pengguna lebuh raya,"" katanya kepada Sinar Harian.

Beliau memberitahu, antara komponen penting dalam pembinaannya ialah pejabat dan bilik mesyuarat, ruang jamuan terbuka, kedai runcit, gelanggang bola keranjang dan gerai makanan.

Tambahnya selain tempat solat, antara ruang penting lain yang dibina ialah bilik pengurusan jenazah, tandas orang kurang upaya dan wakaf berehat musafir.

Justeru Dr Mohd Azmi memberitahu, jumlah dana yang diperlukan ialah RM11,725,640.

Artikel Berkaitan:Dua syarikat perlombongan di Gua Musang diarah henti kerja serta-mertaPenduduk pedalaman Gua Musang bakal nikmati bank bergerakMKT UMNO syor Nenggiri dikecilkan, pecahkan Gua Musang jadi 3 Parlimen

Orang ramai yang ini menghulurkan sumbangan boleh berbuat demikian melalui nombor akaun Bank Islam 03072010139591 atas nama Masjid Mukim Kecil, Bandar Baru Kuala Krai (Ibnu Batutah) atau menghubungi Dr Mohd Azmi Yaacob di talian 019-6565354.

Muat turun aplikasi Sinar Harian.Klik di sini!"
Sistem audit kendalikan wang wakaf,https://www.sinarharian.com.my/article/702307/berita/nasional/sistem-audit-kendalikan-wang-wakaf,2024-12-15 11:35:00,BERITA,"SHAH ALAM - Pusat Pungutan Zakat-Majlis Agama Islam Wilayah Persekutuan (PPZ-MAIWP) menggunakan sistem audit yang rapi dalam mengendalikan aliran wang wakaf agar pembahagian dilakukan dengan sistematik dan telus.

Penolong Pengurus Unit Dakwah dan Produk Wakaf PPZ-MAIWP, Dziyaulhak Hashim berkata, pihaknya bukan sahaja melakukan audit dalaman tetapi turut melibatkan juruaudit negara dan daripada MAIWP.

""Apabila masyarakat mahu berwakaf, mereka mahu melihat ke mana wang disalurkan. Alhamdulillah, di PPZ-MAIWP pengurusan kita sistematik kerana bukan sahaja ada audit dalaman bahkan melibatkan pihak MAIWP sendiri untuk proses pembahagian,"" katanya.

Beliau berkata demikian ketika menjadi panelis Wacana Sinar siri 469 bertajuk 'Kenapa Wakaf Kurang Popular?' yang disiarkan secara langsung di semua platform digital Sinar Harian pada Jumaat.

Program yang dihoskan oleh Mohamad Amiro Safwan itu turut menampilkan pendakwah bebas, Zulkifli Ahmad dan qari Persatuan Orang-orang Cacat Penglihatan Islam Malaysia (Pertis), Muhamad Firdaus Hairi sebagai panel.

Mengulas lanjut, Dziyaulhak berkata, sasaran utama PPZ-MAIWP adalah memberikan sebanyak mungkin manfaat kepada ummah dan wakaf merupakan pemacu ekonomi umat Islam.

""Sekarang kita memfokuskan Pertis dan mereka menyasarkan RM5.75 juta. Kini kita hanya ada RM273,000 sahaja.

Artikel Berkaitan:SMK Shah Alam tekad gempur habis SMK Tinggi KajangRUU Mufti Wilayah Persekutuan ditangguhIsu penempatan pegawai agama Islam: Bantahan MCCBCHST keterlaluan, Islamofobia

""Jika kita berganding bahu, Insya-ALLAH, mudah-mudahan kita dapat bersama dalam usaha membangunkan ummah menerusi kaedah wakaf, semoga ALLAH SWT memberkati kita,"" ujarnya.

Menurutnya, pihak PPZ-MAIWP sentiasa berusaha untuk memberi kesedaran kepada ummah menerusi dakwah yang dilakukan setiap hari sama ada secara fizikal atau dalam talian.

Pada masa sama, katanya, PPZ-MAIWP merupakan satu-satunya organisasi di Kuala Lumpur yang mendapat hak untuk pemberian potongan cukai sebanyak 10 peratus kepada individu atau syarikat berwakaf.

“Kita mengajak pihak luar sana yang masih bertanya kelebihan berwakaf, kita mempunyai potongan cukai berdasarkan Subseksyen 44 (11) D Akta Cukai Pendapatan 1967.

""Jadi, syarikat di luar sana boleh buat potongan wakaf sama seperti program tanggungjawab sosial korporat yang turut mendapat pengecualian cukai 10 peratus,” katanya.

Wakaf bantu tingkatkan milikan tanah, kukuh ekonomi umat Islam

SHAH ALAM - Konsep wakaf dapat membantu meningkatkan milikan tanah terutama di bandar besar seperti Kuala Lumpur dan Pulau Pinang serta memperkukuhkan ekonomi umat Islam secara keseluruhannya.

Pendakwah bebas, Zulkifli Ahmad atau lebih dikenali sebagai Ustaz Zul Pandan berkata, keuntungan dari penyewaan bangunan di atas tanah wakaf mampu menggerakkan ekonomi umat Islam berikutan prinsipnya yang hanya boleh dipajak untuk tempoh tertentu.

“Satu contoh kejayaan wakaf melibatkan tanah ini dapat dilihat di Kuala Lumpur iaitu wakaf tanah diserahkan Ahmad Dawjee Dadabhoy kepada Majlis Agama Islam Wilayah Persekutuan (MAIWP) sebagai pemegang amanah.

“Lembaga Tabung Haji (TH) kemudian menyediakan dana untuk pembinaan bangunan dan Bank Islam menjadi penyewa utama bangunan tersebut. Keuntungan sewaan bangunan ini akhirnya dikembalikan kepada TH dan disalurkan kepada MAIWP untuk terus dimanfaatkan umat Islam.

“Tetapi, sekarang ada satu masalah di tengah Kuala Lumpur dan Pulau Pinang yang mana tanah milikan bumiputera dan umat Islam semakin berkurangan dan banyak terlepas. Jadi, antara kaedah untuk kembalikan tanah ini dan tiada siapa boleh beli adalah dengan wakaf,” katanya.

Beliau berkata demikian ketika menjadi panelis Wacana Sinar siri 469 bertajuk ‘Kenapa Wakaf Kurang Popular?’ yang disiarkan secara langsung di semua platform digital Sinar Harian pada Jumaat.

Mengulas lanjut, Ustaz Zul Pandan berkata, wakaf tidak terhad pemberian berbentuk tanah sahaja, namun ia boleh juga dilakukan dengan wang tunai meskipun hanya RM1 selagi dapat memberi manfaat kepada penerimanya.

Tambah beliau, pahala bagi individu yang berwakaf akan berpanjangan walaupun sehingga dia meninggal dunia.

“Wakaf ini usahanya sekali tetapi manfaatnya berpanjangan dan berturutan. Satu institusi dibangun atas nama wakaf, ia menyebabkan pahala masih mengalir walaupun dia telah meninggal dunia berpuluh tahun.

“Mungkin setengah orang tak ada peluang tersebut tetapi bagi saya harta ini semua orang ada peluang kerana boleh mewakafkan walaupun tidak banyak. Wakaf adalah satu nilai berpanjangan yang harus menjadi keutamaan,” katanya.

Pertis edar al-Quran Braille percuma

SHAH ALAM - Pemberian al-Quran Braille berjaya diedarkan secara percuma kepada golongan orang kurang upaya (OKU) penglihatan Islam menerusi sumbangan wakaf dan dana daripada orang ramai.

Bagaimanapun, qari Persatuan Orang-orang Cacat Penglihatan Islam Malaysia (Pertis), Muhamad Firdaus Hairi berkata, pihaknya terpaksa menampung permintaan yang tinggi berikutan al-Quran tersebut mempunyai jangka hayat tertentu bergantung kekerapan penggunaan.

“Al-Quran Braille ada jaminan antara tiga hingga lima tahun bergantung kekerapan penggunaan sebab tulisan braille, lama kelamaan ia akan hilang apabila disentuh banyak kali,” katanya.

Beliau berkata demikian ketika menjadi panelis Wacana Sinar siri 469 bertajuk ‘Kenapa Wakaf Kurang Popular?’ yang disiarkan secara langsung di semua platform digital Sinar Harian pada Jumaat.

Mengulas lanjut, Muhamad Firdaus berkata, Pertis juga melancarkan pusat dakwah dan memohon bantuan daripada pihak PPZ-MAIWP untuk mencukupkan wakaf atau dana bagi menyediakan bangunan yang mempunyai fasiliti lengkap.

Tambah Muhamad Firdaus, pihaknya berhasrat untuk mewujudkan akademi Pertis iaitu sebuah institusi pendidikan agama yang lengkap khususnya dalam bidang pengajian al-Quran.

“Warga Pertis keseluruhannya yang mempunyai 2,500 ahli yang berdaftar manakala belum berdaftar mungkin lebih ramai,” ulasnya.

Muat turun aplikasi Sinar Harian.Klik di sini!"
Carian Umum,https://prpm.dbp.gov.my/Cari1?keyword=bank+islam,,,Definisi : bank yg urus niaga kewangan dan pengagihan dananya berdasarkan syariat Islam; (Kamus Dewan Edisi Keempat)
